{
    "engine": "nextflows|snakemake",
    "src": {
        "type": "remote",
        "url": "https://github.com/...",
        "version": "main"
    },
    "engine_parameters": [],
    "parameters": {
        "dynamic": [
            {
                "type": "text",
                "name": "example",
                "label": "Example",
                "desc": "Check out the input elements at: https://cubimedrub.github.io/macworp/latest/workflow_integration/#definition-elements"
            }
        ],
        "static": [
            {
                "type": "text",
                "name": "example-static",
                "label": "Example static",
                "desc": "Check out the input elements at: https://cubimedrub.github.io/macworp/latest/workflow_integration/#definition-elements"
            }
        ]
    }
}